{
  "planVersion": "0.1",
  "roomId": "room-local-001",
  "expectedRoomRevision": 3,
  "instances": [
    {
      "instanceId": "mortgage-1",
      "component": {
        "id": "org.workbench.example.mortgage-calc",
        "version": "0.1.0",
        "sha256": "0000000000000000000000000000000000000000000000000000000000000000"
      }
    }
  ],
  "connections": [
    {
      "from": {
        "instanceId": "form-1",
        "port": "loan"
      },
      "to": {
        "instanceId": "mortgage-1",
        "port": "loan"
      }
    }
  ],
  "ui": {
    "definitionRef": "org.workbench.example.mortgage-calc/ui.json"
  },
  "requestedPermissions": [
    {
      "componentInstance": "mortgage-1",
      "capability": "filesystem.read",
      "scope": {
        "paths": [
          "/example"
        ]
      },
      "duration": "session"
    }
  ]
}
